{"document_type":"rust-mutants/skeletons","schema_version":3,"items":[{"index":0,"item":{"package":"fixture-doctest","path":"src/lib.rs","ordinal":0},"name":"double","body_digest":"2062cf31d87115fbf1aa4cc45aeca3efcffd13721446fd0d28627a71fc02e78f","sealed":true,"unsealed":null,"start":{"line":11,"column":30}},{"index":1,"item":{"package":"fixture-doctest","path":"src/lib.rs","ordinal":1},"name":"half","body_digest":"e73f848cc1c57757d55903678cfd2267baa085d884bb7f0d0bdf2926369d6da5","sealed":true,"unsealed":null,"start":{"line":20,"column":28}},{"index":2,"item":{"package":"fixture-doctest","path":"src/lib.rs","ordinal":2},"name":"third","body_digest":"0f1decb01d7e8296646db6b76c52473f1f48edd740bf8a110fad487b40cf0213","sealed":true,"unsealed":null,"start":{"line":29,"column":29}},{"index":3,"item":{"package":"fixture-doctest","path":"src/lib.rs","ordinal":3},"name":"tests::doubling_two_is_four","body_digest":"d2124becc51c11b3ae34812ebacd12e8a1dfb4c6895edcf7870004c360d96fab","sealed":true,"unsealed":null,"start":{"line":36,"column":31}}],"files":{"src/lib.rs":"c7b7c94bfbb34471d9d9515b4378d7d791aad88704d7478e95fae5e752cd61c7"},"units":[{"package":"fixture-doctest","target":"fixture_doctest","kind":"lib","test":false,"skeleton":"e1d4ff3ffa91e00918f754905e7f1cca27762ab9060ab7972765498d26a5550e","entries":{"$positions/$root/src/lib.rs":"4c71fdcc2577d2dcd619a77c7980b9533317598833fc9a51b9fd8f95f8ba2072","$root/src/lib.rs":"b26c2b8edc0682c9c9f26c762ce50463497e535e2c988d78cae8972ddb092a66"}},{"package":"fixture-doctest","target":"fixture_doctest","kind":"lib","test":true,"skeleton":"e1d4ff3ffa91e00918f754905e7f1cca27762ab9060ab7972765498d26a5550e","entries":{"$positions/$root/src/lib.rs":"4c71fdcc2577d2dcd619a77c7980b9533317598833fc9a51b9fd8f95f8ba2072","$root/src/lib.rs":"b26c2b8edc0682c9c9f26c762ce50463497e535e2c988d78cae8972ddb092a66"}}]}