{"document_type":"rust-mutants/skeletons","schema_version":3,"items":[{"index":0,"item":{"package":"fixture-declines","path":"src/lib.rs","ordinal":0},"name":"can_share","body_digest":"920dc1f16b841025b4b7f2e5275e8da4e69483455b321a56c22af7b00a1db700","sealed":true,"unsealed":null,"start":{"line":7,"column":28}},{"index":1,"item":{"package":"fixture-declines","path":"src/lib.rs","ordinal":1},"name":"can_measure","body_digest":"e0780b34000173b80815f11ade722ee07515486c45c2393dd7347dbbb6c05e3c","sealed":true,"unsealed":null,"start":{"line":12,"column":30}},{"index":2,"item":{"package":"fixture-declines","path":"src/lib.rs","ordinal":2},"name":"shared","body_digest":"2225a84ad04d8b725d1d6e4c3b9ec21604cda729943ba5a6e979af62f1f50178","sealed":true,"unsealed":null,"start":{"line":17,"column":34}},{"index":3,"item":{"package":"fixture-declines","path":"src/lib.rs","ordinal":3},"name":"counted","body_digest":"536a3ef0f19f2370c3b49fb1f43d6c499e512a12846fcddacc60be040294aa54","sealed":true,"unsealed":null,"start":{"line":22,"column":35}},{"index":4,"item":{"package":"fixture-declines","path":"src/lib.rs","ordinal":4},"name":"measured","body_digest":"eebd30685344eaffc1badb36c90b29556fb0521875e3980bc43d83cac774985f","sealed":true,"unsealed":null,"start":{"line":27,"column":36}},{"index":5,"item":{"package":"fixture-declines","path":"src/lib.rs","ordinal":5},"name":"halved","body_digest":"c58e28400c25da0125f12574555457cec09ef7a321ecb94176b721865415ca00","sealed":true,"unsealed":null,"start":{"line":32,"column":34}},{"index":6,"item":{"package":"fixture-declines","path":"src/lib.rs","ordinal":6},"name":"tests::decline","body_digest":"64aee02ce6c8abeee607c17165d8269d1dee7e56c5d80912feb72f0feafb9124","sealed":true,"unsealed":null,"start":{"line":41,"column":27}},{"index":7,"item":{"package":"fixture-declines","path":"src/lib.rs","ordinal":7},"name":"tests::doubles_what_it_shares","body_digest":"fc1a4bd68000e069c1edce3e6902a2a60f7ab00f31e1e9b7c2bb2a3cdf245c7b","sealed":true,"unsealed":null,"start":{"line":57,"column":33}},{"index":8,"item":{"package":"fixture-declines","path":"src/lib.rs","ordinal":8},"name":"tests::counts_what_it_shares","body_digest":"64beb12efae6e1a96d0b210509a884725161522e40f8cfb0eef82252019a6f57","sealed":true,"unsealed":null,"start":{"line":67,"column":32}},{"index":9,"item":{"package":"fixture-declines","path":"src/lib.rs","ordinal":9},"name":"tests::counts_without_looking","body_digest":"5aaac8f3e690aa91ef71b7e250828f13636d81f9e6ec2f6bd97a98e2c6e982ac","sealed":true,"unsealed":null,"start":{"line":77,"column":33}},{"index":10,"item":{"package":"fixture-declines","path":"src/lib.rs","ordinal":10},"name":"tests::halves_what_it_shares","body_digest":"38796ca2257ea937ee3c8fce8cc03f205362a75bfd530f5fec19a35bea4496bd","sealed":true,"unsealed":null,"start":{"line":82,"column":32}},{"index":11,"item":{"package":"fixture-declines","path":"src/lib.rs","ordinal":11},"name":"tests::adds_ten","body_digest":"beb853382a27050f48c8becd6d7e454fc0824f96aac575d00771fcea18d88a68","sealed":true,"unsealed":null,"start":{"line":92,"column":19}},{"index":12,"item":{"package":"fixture-declines","path":"tests/elsewhere.rs","ordinal":0},"name":"halves_without_looking","body_digest":"839ee379f96e725ef41e5fc7b191e2424d4723fb30be0d388752b48d4cc34047","sealed":true,"unsealed":null,"start":{"line":7,"column":29}}],"files":{"src/lib.rs":"42342b3e64fbd6df99f7e6537ed0c66a12457413e85c494bb7dced2ef9bd3f71","tests/elsewhere.rs":"06c0930b70ac9cae7c31fd92a8414639fcd71c7484ff0707780d5d021c328b0c"},"units":[{"package":"fixture-declines","target":"elsewhere","kind":"test","test":true,"skeleton":"6e648b75554da68137a0bd55e0597f80dd631ea2551d4d39afc6589536f487c8","entries":{"$positions/$root/tests/elsewhere.rs":"e3b0c44298fc1c149afbf4c8996fb92427ae41e4649b934ca495991b7852b855","$root/tests/elsewhere.rs":"b463793c4f544d313a9cfc30107d3512ea047bf0e45a68cf15494a869e7ee6ec"}},{"package":"fixture-declines","target":"fixture_declines","kind":"lib","test":false,"skeleton":"cbef13cba5f4a984123e46d8cb8d024233481b4c94d8b13256f6affb17ff81c0","entries":{"$positions/$root/src/lib.rs":"e3b0c44298fc1c149afbf4c8996fb92427ae41e4649b934ca495991b7852b855","$root/src/lib.rs":"d5f0bd066ada74835489fa6a1eabbdbe7fbc1c45d70beaa80853012e63f9b768"}},{"package":"fixture-declines","target":"fixture_declines","kind":"lib","test":true,"skeleton":"cbef13cba5f4a984123e46d8cb8d024233481b4c94d8b13256f6affb17ff81c0","entries":{"$positions/$root/src/lib.rs":"e3b0c44298fc1c149afbf4c8996fb92427ae41e4649b934ca495991b7852b855","$root/src/lib.rs":"d5f0bd066ada74835489fa6a1eabbdbe7fbc1c45d70beaa80853012e63f9b768"}}]}