{"document_type":"rust-mutants/skeletons","schema_version":3,"items":[{"index":0,"item":{"package":"fixture-faulted","path":"src/lib.rs","ordinal":0},"name":"load","body_digest":"f2eb95130c65c760ef21391af39b2a49056b826ff6627519c07b10e46d018bb8","sealed":true,"unsealed":null,"start":{"line":12,"column":53}},{"index":1,"item":{"package":"fixture-faulted","path":"src/lib.rs","ordinal":1},"name":"number","body_digest":"b3fa12ca4f00d92ae2b3db72fa04274cd69701f1f7b5464826e3db2721d4f881","sealed":true,"unsealed":null,"start":{"line":21,"column":66}},{"index":2,"item":{"package":"fixture-faulted","path":"src/lib.rs","ordinal":2},"name":"length","body_digest":"fb2338bc6081f0190163229fe23fd56407ba25772f6ed1fcbd4356507ab9af5b","sealed":true,"unsealed":null,"start":{"line":28,"column":37}},{"index":3,"item":{"package":"fixture-faulted","path":"src/lib.rs","ordinal":3},"name":"measured","body_digest":"74a4e0f70b56eff312ba8455932a3812ca6de93744db17e833a94e0205b30c30","sealed":true,"unsealed":null,"start":{"line":32,"column":52}},{"index":4,"item":{"package":"fixture-faulted","path":"src/lib.rs","ordinal":4},"name":"ours","body_digest":"b8fd11c8392ef609bc7b1ea0ba04686628d1c3db44a9b1b5567969c3256bc2ae","sealed":true,"unsealed":null,"start":{"line":45,"column":38}},{"index":5,"item":{"package":"fixture-faulted","path":"src/lib.rs","ordinal":5},"name":"inner","body_digest":"0915f55d08e79c719465276039300ff3f18783b54efede2585d31ee48e493b7c","sealed":true,"unsealed":null,"start":{"line":50,"column":35}},{"index":6,"item":{"package":"fixture-faulted","path":"src/lib.rs","ordinal":6},"name":"maybe","body_digest":"5824aa540b269c3c188bfbf92795fc6d538f477627724df67af1d587f8274141","sealed":true,"unsealed":null,"start":{"line":56,"column":47}},{"index":7,"item":{"package":"fixture-faulted","path":"tests/calls.rs","ordinal":0},"name":"the_manifest_loads","body_digest":"d455eb673a4caca00c6c193eb9624fa9c7e7842085ca3dcb7ea25e02717efbe7","sealed":true,"unsealed":null,"start":{"line":9,"column":25}},{"index":8,"item":{"package":"fixture-faulted","path":"tests/calls.rs","ordinal":1},"name":"seven_is_a_number","body_digest":"0ed24b9d76a68048461e70a537de99b1781a9f1d95eed0dc548ba4ae77c7bdf1","sealed":true,"unsealed":null,"start":{"line":14,"column":24}},{"index":9,"item":{"package":"fixture-faulted","path":"tests/calls.rs","ordinal":2},"name":"a_length_is_asked_and_never_checked","body_digest":"933956e622e502dd3589e75a940bdb83ec1e10ca44ae42f44db8fc55fa157e52","sealed":true,"unsealed":null,"start":{"line":19,"column":42}},{"index":10,"item":{"package":"fixture-faulted","path":"tests/calls.rs","ordinal":3},"name":"ours_and_maybe_answer","body_digest":"8c3c564f6cc13b4bc93a9afeaa9164f34c4f60c4335a1302ac63e86da8455296","sealed":true,"unsealed":null,"start":{"line":24,"column":28}}],"files":{"src/lib.rs":"20e9e4977cb7b4e3f9ec3bb72da096f20a234e43af90f7c96ba2e71b2906801f","tests/calls.rs":"8842146df3a02232e5d5a3056e989f7308b8af09dc9085ae59e4d3429a4184f0"},"units":[{"package":"fixture-faulted","target":"calls","kind":"test","test":true,"skeleton":"299291ca5ee050f866813cbba81996178644a06888a36779da5a31ce583fac6f","entries":{"$positions/$root/tests/calls.rs":"e3b0c44298fc1c149afbf4c8996fb92427ae41e4649b934ca495991b7852b855","$root/tests/calls.rs":"589f170d4034384a0646c4024b46c8dcb519fd644e861189bd91c4eeb302c660"}},{"package":"fixture-faulted","target":"fixture_faulted","kind":"lib","test":false,"skeleton":"b7711391fc221e47aaefe4dbaa380d27295a408e199e3e3291fac456f40430e1","entries":{"$positions/$root/src/lib.rs":"3c335995ead2f81398298501c654119ffcefbdb56c71d540d0585a2d1748d61e","$root/src/lib.rs":"953d44d7933dc4c80e46532a89c4d4c5b91347e388bf084eca6e700f31ed5902"}},{"package":"fixture-faulted","target":"fixture_faulted","kind":"lib","test":true,"skeleton":"b7711391fc221e47aaefe4dbaa380d27295a408e199e3e3291fac456f40430e1","entries":{"$positions/$root/src/lib.rs":"3c335995ead2f81398298501c654119ffcefbdb56c71d540d0585a2d1748d61e","$root/src/lib.rs":"953d44d7933dc4c80e46532a89c4d4c5b91347e388bf084eca6e700f31ed5902"}}]}